{
  "auditVersion": "0.1.0",
  "flowId": "u1.invariant.v2",
  "revisionRound": 2,
  "scores": {
    "sourceGrounding": 2,
    "knowledgeTypeFit": 2,
    "misconceptionQuality": 2,
    "hintLadder": 2,
    "evidenceIntegrity": 2,
    "transferQuality": 2,
    "rendererFit": 2
  },
  "total": 14,
  "criticalFailures": [],
  "gaps": {
    "source": [],
    "renderer": []
  },
  "findings": [
    {
      "dimension": "sourceGrounding",
      "severity": "major",
      "issue": "The interrupted production draft treated the project-specific remainder-rescaling extension as part of the textbook-grounded invariant lesson.",
      "revision": "Narrow the ready flow to the quotient-invariance rule directly supported by the inspected textbook exploration table; keep the remainder extension outside this ready Course Package unless separately sourced.",
      "resolved": true
    }
  ],
  "decision": "pass",
  "finalRecommendation": "ready",
  "summary": "After textbook re-grounding, the ready scope is limited to the directly supported quotient-invariance rule; same-factor/nonzero conditions, fresh independent evidence, and simplification transfer satisfy the ready gate."
}
