{
  "auditVersion": "0.1.0",
  "flowId": "u5.compare.v2",
  "revisionRound": 1,
  "scores": {
    "sourceGrounding": 2,
    "knowledgeTypeFit": 2,
    "misconceptionQuality": 2,
    "hintLadder": 2,
    "evidenceIntegrity": 2,
    "transferQuality": 2,
    "rendererFit": 2
  },
  "total": 14,
  "criticalFailures": [],
  "gaps": {
    "source": [],
    "renderer": []
  },
  "findings": [],
  "decision": "pass",
  "finalRecommendation": "ready",
  "summary": "Comparison, exact rewrite, approximation-symbol semantics, fresh equality evidence, and mixed-unit transfer all satisfy ready gate."
}
