{
  "auditVersion": "0.1.0",
  "flowId": "u6.multiply.v2",
  "revisionRound": 1,
  "scores": {
    "sourceGrounding": 2,
    "knowledgeTypeFit": 2,
    "misconceptionQuality": 2,
    "hintLadder": 2,
    "evidenceIntegrity": 2,
    "transferQuality": 2,
    "rendererFit": 2
  },
  "total": 14,
  "criticalFailures": [],
  "gaps": {
    "source": [],
    "renderer": []
  },
  "findings": [],
  "decision": "pass",
  "finalRecommendation": "ready",
  "summary": "The Skill-generated multiplication flow already has textbook source metadata, place-value misconceptions, generic partial-product representation, fresh independent evidence, zero-handling repair, and transfer; no flow revision is needed."
}
