{
  "auditVersion": "0.1.0",
  "flowId": "u5.place.v2",
  "revisionRound": 1,
  "scores": {
    "sourceGrounding": 2,
    "knowledgeTypeFit": 2,
    "misconceptionQuality": 2,
    "hintLadder": 2,
    "evidenceIntegrity": 2,
    "transferQuality": 2,
    "rendererFit": 2
  },
  "total": 14,
  "criticalFailures": [],
  "gaps": {
    "source": [],
    "renderer": []
  },
  "findings": [],
  "decision": "pass",
  "finalRecommendation": "ready",
  "summary": "Textbook place-value, decimal adjacent-unit, and four-digit-group structures are integrated with reusable placeValueGroups representation, fresh independent evidence, and transfer."
}
