{
  "auditVersion": "0.1.0",
  "flowId": "u4.order.v2",
  "revisionRound": 1,
  "scores": {
    "sourceGrounding": 2,
    "knowledgeTypeFit": 2,
    "misconceptionQuality": 2,
    "hintLadder": 2,
    "evidenceIntegrity": 2,
    "transferQuality": 2,
    "rendererFit": 2
  },
  "total": 14,
  "criticalFailures": [],
  "gaps": {
    "source": [],
    "renderer": []
  },
  "findings": [],
  "decision": "pass",
  "finalRecommendation": "ready",
  "summary": "Textbook precedence and same-level rules are separated cleanly from bracket logic, with targeted misconception repair, fresh independent evidence, and transfer."
}
