{
  "auditVersion": "0.1.0",
  "flowId": "u2.change.v2",
  "revisionRound": 1,
  "scores": {
    "sourceGrounding": 2,
    "knowledgeTypeFit": 2,
    "misconceptionQuality": 2,
    "hintLadder": 2,
    "evidenceIntegrity": 2,
    "transferQuality": 2,
    "rendererFit": 2
  },
  "total": 14,
  "criticalFailures": [],
  "gaps": {
    "source": [],
    "renderer": []
  },
  "findings": [],
  "decision": "pass",
  "finalRecommendation": "ready",
  "summary": "Textbook fixed-area/fixed-perimeter experiments are preserved as comparative representation tasks, reusing rect without new infrastructure and requiring fresh independent/transfer evidence."
}
