{
  "auditVersion": "0.1.0",
  "flowId": "u2.cut.v2",
  "revisionRound": 1,
  "scores": {
    "sourceGrounding": 2,
    "knowledgeTypeFit": 2,
    "misconceptionQuality": 2,
    "hintLadder": 2,
    "evidenceIntegrity": 2,
    "transferQuality": 2,
    "rendererFit": 2
  },
  "total": 14,
  "criticalFailures": [],
  "gaps": {
    "source": [],
    "renderer": []
  },
  "findings": [
    {
      "dimension": "rendererFit",
      "severity": "major",
      "issue": "Existing renderers did not distinguish counted outer edges from internal seams or wall-replaced edges.",
      "revision": "Add generic boundaryTrace renderer with semantic counted/excluded edge roles.",
      "resolved": true
    }
  ],
  "decision": "pass",
  "finalRecommendation": "ready",
  "summary": "Textbook-grounded wall/seam boundary reasoning, same-area/different-perimeter distinction, generic boundary renderer, fresh composite-boundary evidence, and compactness transfer satisfy ready gate."
}
