{
  "auditVersion": "0.1.0",
  "flowId": "u4.bracket.v2",
  "revisionRound": 2,
  "scores": {
    "sourceGrounding": 2,
    "knowledgeTypeFit": 2,
    "misconceptionQuality": 2,
    "hintLadder": 2,
    "evidenceIntegrity": 2,
    "transferQuality": 2,
    "rendererFit": 2
  },
  "total": 14,
  "criticalFailures": [],
  "gaps": {
    "source": [],
    "renderer": []
  },
  "findings": [],
  "decision": "pass",
  "finalRecommendation": "ready",
  "summary": "After textbook re-grounding and flow refinement, parentheses priority, nested-bracket order, fresh independent computation, and changed-parentheses transfer satisfy the ready gate."
}
