{
  "auditVersion": "0.1.0",
  "flowId": "u6.estimate.v2",
  "revisionRound": 2,
  "scores": {
    "sourceGrounding": 2,
    "knowledgeTypeFit": 2,
    "misconceptionQuality": 2,
    "hintLadder": 2,
    "evidenceIntegrity": 2,
    "transferQuality": 2,
    "rendererFit": 2
  },
  "total": 14,
  "criticalFailures": [],
  "gaps": {
    "source": [],
    "renderer": []
  },
  "findings": [
    {
      "dimension": "sourceGrounding",
      "severity": "major",
      "issue": "Phase 3.3 relied partly on project-designed racket/food examples and treated the one-sided-bound formulation as if fully sourced.",
      "revision": "Re-ground the core rule in textbook pp.96, 99, and 102: manuscript completion, calculator budget, and library-distance decisions; explicitly label “bound/threshold” as a mathematical synthesis rather than textbook wording.",
      "resolved": true
    },
    {
      "dimension": "rendererFit",
      "severity": "major",
      "issue": "No generic renderer represented an estimate bound against a decision threshold.",
      "revision": "Add the generic thresholdBound renderer with dynamic labels, units, relation, conclusion, and accessible semantics.",
      "resolved": true
    },
    {
      "dimension": "evidenceIntegrity",
      "severity": "major",
      "issue": "The earlier draft lacked an explicit fresh INDEPENDENT_PASS before transfer.",
      "revision": "Use the textbook 58 m/min × 12 min versus 800 m item as fresh independent evidence and emit INDEPENDENT_PASS before formalization/transfer.",
      "resolved": true
    }
  ],
  "decision": "pass",
  "finalRecommendation": "ready",
  "summary": "Textbook grounding, threshold renderer support, and explicit fresh independent evidence are all closed; the package now satisfies the ready gate at 14/14."
}
