{
  "auditVersion": "0.1.0",
  "flowId": "u5.round.v2",
  "revisionRound": 1,
  "scores": {
    "sourceGrounding": 2,
    "knowledgeTypeFit": 2,
    "misconceptionQuality": 2,
    "hintLadder": 2,
    "evidenceIntegrity": 2,
    "transferQuality": 2,
    "rendererFit": 2
  },
  "total": 14,
  "criticalFailures": [],
  "gaps": {
    "source": [],
    "renderer": []
  },
  "findings": [
    {
      "dimension": "evidenceIntegrity",
      "severity": "major",
      "issue": "The early reverse-range task did not emit current-format independent evidence, and the repaired path proceeded directly to transfer.",
      "revision": "Emit INDEPENDENT_PASS on direct reverse-range success and add a fresh 12万 half-open interval item after reverse repair before transfer.",
      "resolved": true
    },
    {
      "dimension": "sourceGrounding",
      "severity": "minor",
      "issue": "The early package lacked current-format source metadata.",
      "revision": "Add ready metadata and source note for textbook pp.80-81 and 84-88.",
      "resolved": true
    }
  ],
  "decision": "pass",
  "finalRecommendation": "ready",
  "summary": "Number-line/boundary reasoning, half-open reverse intervals, unit checking, targeted repairs, explicit independent range evidence, and transfer all satisfy the current ready gate."
}
